{
  "schema_version": "1.0",
  "profile_id": "fixture_provider_profile_pending_v1",
  "environment": "development",
  "development_execution": {
    "access_preference": "codex_subscription",
    "surface": "codex_builtin_image_generation",
    "model": "gpt-image-2",
    "status": "documented_preference_not_live_tested",
    "source_url": "https://learn.chatgpt.com/docs/image-generation",
    "inspected_on": "2026-10-10",
    "scope": "development_execution_only"
  },
  "live_test_authorization": {
    "status": "pending",
    "owner_role": "Agent and research with provider/account administrator",
    "reservation_ref": null,
    "evidence_ref": null,
    "authorized_capabilities": []
  },
  "capabilities": [
    {
      "id": "jev",
      "required": true,
      "provider": "typesafe",
      "owner_role": "Agent and research",
      "next_action": "Provider administrator to confirm eligibility and credential injection; runtime owner to approve a pinned model policy.",
      "blocked_consumers": ["ACV1-JEV-EVAL", "AH04", "AH05", "AH10", "AH12"],
      "configuration": {
        "provider": "typesafe",
        "api_family": "systemone_v1",
        "endpoint": "https://api.typesafe.ai/v1/systemone",
        "sdk": null,
        "model": {
          "requested": null,
          "resolved": null,
          "identity_kind": "unselected",
          "policy_status": "pending",
          "approved_model": null,
          "expected_resolved": null,
          "approval_ref": null,
          "approved_by_role": null,
          "approved_at": null,
          "revalidate_by": null
        },
        "credential_env": "TYPESAFE_API_KEY",
        "account_ref": null,
        "project_ref": null,
        "quota_status": "unknown",
        "quota_evidence_ref": null,
        "environment": "development",
        "billing_mode": "unknown",
        "quota_summary": null
      },
      "eligibility": {
        "status": "pending",
        "checked_at": null,
        "valid_until": null,
        "account_ref": null,
        "project_ref": null,
        "evidence_ref": null
      },
      "metadata": {
        "status": "not_run",
        "kind": "none",
        "checked_at": null,
        "valid_until": null,
        "endpoint": null,
        "account_ref": null,
        "project_ref": null,
        "requested_model": null,
        "resolved_model": null,
        "evidence_ref": null
      },
      "live": {
        "status": "pending",
        "dependency_mode": "not_run",
        "checked_at": null,
        "valid_until": null,
        "endpoint": null,
        "account_ref": null,
        "project_ref": null,
        "requested_model": null,
        "resolved_model": null,
        "evidence_ref": null
      },
      "future_usage_authorization": null,
      "sponsor_integration": null
    },
    {
      "id": "gpt_image",
      "required": true,
      "provider": "openai",
      "owner_role": "Creative and fulfillment",
      "next_action": "Creative owner to select an approved engine API family and provider account access; retain Codex subscription image use as a separate development path.",
      "blocked_consumers": ["creative-engine:CE-01", "ACV1-AH05", "ACV1-AH10", "ACV1-AH12"],
      "configuration": {
        "provider": "openai",
        "api_family": null,
        "endpoint": null,
        "sdk": null,
        "model": {
          "requested": null,
          "resolved": null,
          "identity_kind": "unselected",
          "policy_status": "pending",
          "approved_model": null,
          "expected_resolved": null,
          "approval_ref": null,
          "approved_by_role": null,
          "approved_at": null,
          "revalidate_by": null
        },
        "credential_env": null,
        "account_ref": null,
        "project_ref": null,
        "quota_status": "unknown",
        "quota_evidence_ref": null,
        "environment": "development",
        "billing_mode": "unknown",
        "quota_summary": null
      },
      "eligibility": {
        "status": "pending",
        "checked_at": null,
        "valid_until": null,
        "account_ref": null,
        "project_ref": null,
        "evidence_ref": null
      },
      "metadata": {
        "status": "not_run",
        "kind": "none",
        "checked_at": null,
        "valid_until": null,
        "endpoint": null,
        "account_ref": null,
        "project_ref": null,
        "requested_model": null,
        "resolved_model": null,
        "evidence_ref": null
      },
      "live": {
        "status": "pending",
        "dependency_mode": "not_run",
        "checked_at": null,
        "valid_until": null,
        "endpoint": null,
        "account_ref": null,
        "project_ref": null,
        "requested_model": null,
        "resolved_model": null,
        "evidence_ref": null
      },
      "future_usage_authorization": null,
      "sponsor_integration": null
    },
    {
      "id": "planner_reasoning",
      "required": true,
      "provider": null,
      "owner_role": "Agent and research",
      "next_action": "Provider and runtime owners to select the bounded planner/reasoning provider and account configuration.",
      "blocked_consumers": ["AH04", "ACV1-JEV-EVAL"],
      "configuration": {
        "provider": null,
        "api_family": null,
        "endpoint": null,
        "sdk": null,
        "model": {
          "requested": null,
          "resolved": null,
          "identity_kind": "unselected",
          "policy_status": "pending",
          "approved_model": null,
          "expected_resolved": null,
          "approval_ref": null,
          "approved_by_role": null,
          "approved_at": null,
          "revalidate_by": null
        },
        "credential_env": null,
        "account_ref": null,
        "project_ref": null,
        "quota_status": "unknown",
        "quota_evidence_ref": null,
        "environment": "development",
        "billing_mode": "unknown",
        "quota_summary": null
      },
      "eligibility": {
        "status": "pending",
        "checked_at": null,
        "valid_until": null,
        "account_ref": null,
        "project_ref": null,
        "evidence_ref": null
      },
      "metadata": {
        "status": "not_run",
        "kind": "none",
        "checked_at": null,
        "valid_until": null,
        "endpoint": null,
        "account_ref": null,
        "project_ref": null,
        "requested_model": null,
        "resolved_model": null,
        "evidence_ref": null
      },
      "live": {
        "status": "pending",
        "dependency_mode": "not_run",
        "checked_at": null,
        "valid_until": null,
        "endpoint": null,
        "account_ref": null,
        "project_ref": null,
        "requested_model": null,
        "resolved_model": null,
        "evidence_ref": null
      },
      "future_usage_authorization": {
        "status": "pending",
        "owner_role": "Agent and research",
        "live_test_owner_role": "Agent and research",
        "budget_ref": null,
        "reservation_protocol_ref": null
      },
      "sponsor_integration": null
    },
    {
      "id": "generative_baseline",
      "required": true,
      "provider": null,
      "owner_role": "Agent and research",
      "next_action": "Evaluation and provider owners to select a separate generative baseline provider, account and model.",
      "blocked_consumers": ["ACV1-JEV-EVAL"],
      "configuration": {
        "provider": null,
        "api_family": null,
        "endpoint": null,
        "sdk": null,
        "model": {
          "requested": null,
          "resolved": null,
          "identity_kind": "unselected",
          "policy_status": "pending",
          "approved_model": null,
          "expected_resolved": null,
          "approval_ref": null,
          "approved_by_role": null,
          "approved_at": null,
          "revalidate_by": null
        },
        "credential_env": null,
        "account_ref": null,
        "project_ref": null,
        "quota_status": "unknown",
        "quota_evidence_ref": null,
        "environment": "development",
        "billing_mode": "unknown",
        "quota_summary": null
      },
      "eligibility": {
        "status": "pending",
        "checked_at": null,
        "valid_until": null,
        "account_ref": null,
        "project_ref": null,
        "evidence_ref": null
      },
      "metadata": {
        "status": "not_run",
        "kind": "none",
        "checked_at": null,
        "valid_until": null,
        "endpoint": null,
        "account_ref": null,
        "project_ref": null,
        "requested_model": null,
        "resolved_model": null,
        "evidence_ref": null
      },
      "live": {
        "status": "pending",
        "dependency_mode": "not_run",
        "checked_at": null,
        "valid_until": null,
        "endpoint": null,
        "account_ref": null,
        "project_ref": null,
        "requested_model": null,
        "resolved_model": null,
        "evidence_ref": null
      },
      "future_usage_authorization": {
        "status": "pending",
        "owner_role": "Agent and research",
        "live_test_owner_role": "Agent and research",
        "budget_ref": null,
        "reservation_protocol_ref": null
      },
      "sponsor_integration": null
    },
    {
      "id": "neatlogs",
      "required": true,
      "provider": "neatlogs",
      "owner_role": "Finance and reliability",
      "next_action": "Confirm workspace, service-account scope, owner and actual trace-evidence collection path.",
      "blocked_consumers": ["SPN-01"],
      "configuration": {
        "provider": "neatlogs",
        "api_family": null,
        "endpoint": null,
        "sdk": null,
        "model": {
          "requested": null,
          "resolved": null,
          "identity_kind": "unselected",
          "policy_status": "pending",
          "approved_model": null,
          "expected_resolved": null,